<?xml version="1.0" encoding="UTF-8"?>
<nfv xmlns="http://www.polito.it/schemas/nfvInfo" xmlns:tns="http://www.polito.it/schemas/nfvInfo" xmlns:xsi="http://www.w3.org/2001/XMLSchema-instance" xsi:schemaLocation="http://www.polito.it/schemas/nfvInfo nfvInfo.xsd ">
  <vnfCatalog>
    <vnf functionalType="SPAM" name="spam1">
      <requiredMemory>128</requiredMemory>
      <requiredStorage>256</requiredStorage>
    </vnf>
    <vnf functionalType="FW" name="mainFW">
      <requiredMemory>256</requiredMemory>
      <requiredStorage>128</requiredStorage>
    </vnf>
    <vnf functionalType="WEB_SERVER" name="www1">
      <requiredMemory>1024</requiredMemory>
      <requiredStorage>4096</requiredStorage>
    </vnf>
  </vnfCatalog>
  <hosts>
    <host name="host1">
      <availableMemory>0</availableMemory>
      <availableStorage>0</availableStorage>
      <maxVNFs>0</maxVNFs>
      <deployedNodes>
        <deployedNode name="node2"/>
      </deployedNodes>
      <connections>
    <connection destination="host2">
      <performance>
        <latency>1</latency>
        <throughput>0.01</throughput>
      </performance>
    </connection>
    <connection destination="host1">
      <performance>
        <latency>1</latency>
        <throughput>0.01</throughput>
      </performance>
    </connection>
  </connections>
    </host>
    <host name="host2">
      <availableMemory>0</availableMemory>
      <availableStorage>0</availableStorage>
      <maxVNFs>0</maxVNFs>
      <deployedNodes>
        <deployedNode name="node1"/>
      </deployedNodes>
    <connections>
    <connection destination="host1">
      <performance>
        <latency>1</latency>
        <throughput>0.01</throughput>
      </performance>
    </connection>
    <connection destination="host2">
      <performance>
        <latency>1</latency>
        <throughput>0.01</throughput>
      </performance>
    </connection>
  </connections>
    
    </host>
  </hosts>
  
  <nffgs>
    <nffg name="">
      <deployTime>2001-12-31T12:00:00</deployTime>
      <nodes>
        <node host="" name="node2" vnf="spam1">
          <link name="link1" destination="node3">
            <performance>
              <latency>1</latency>
              <throughput>0.01</throughput>
            </performance>
          </link>
        </node>
        <node host="" name="node1" vnf="spam1">
          <link name="link2" destination="node1" >
            <performance>
              <latency>1</latency>
              <throughput>0.01</throughput>
            </performance>
          </link>
        </node>
      </nodes>
    </nffg>
        <nffg name="2">
      <deployTime>2001-12-31T12:00:00</deployTime>
      <nodes>
        <node host="" name="node3" vnf="spam1">
          <link name="link1" destination="node3">
            <performance>
              <latency>1</latency>
              <throughput>0.01</throughput>
            </performance>
          </link>
        </node>
        <node host="" name="node4" vnf="spam1">
          <link name="link2" destination="node1">
            <performance>
              <latency>1</latency>
              <throughput>0.01</throughput>
            </performance>
          </link>
        </node>
      </nodes>
    </nffg>
  </nffgs>
</nfv>
